0.000000    192.168.1.10          192.168.1.20          TCP      74     54321 > 80 [SYN] Seq=0
0.000125    192.168.1.20          192.168.1.10          TCP      66     80 > 54321 [SYN, ACK] Seq=0
0.001500    192.168.1.10          192.168.1.20          TCP      74     54321 > 80 [ACK] Seq=1
0.004000    192.168.1.10          192.168.1.20          HTTP     431    GET /index.html HTTP/1.1
0.006200    192.168.1.20          192.168.1.10          TCP      66     80 > 54321 [ACK]
0.009800    192.168.1.10          192.168.1.20          TCP      74     54321 > 80 [PSH, ACK]
